{
 "meta": {
  "date": "2026-10-14",
  "rule": {
   "min_total": 150,
   "min_paired": 100
  },
  "representation": "Current GDC file metadata (RNA-seq gene expression quantification; Illumina 450k methylation beta values), joined to PanCanAtlas quality annotations",
  "historical_representation": "PanCanAtlas final harmonized RNA and 450k-only matrices, header-level membership",
  "historical_unmatched_primary_columns": {
   "rna": 33,
   "met": 0
  },
  "panel": [
   "BLCA",
   "BRCA",
   "CESC",
   "COAD",
   "ESCA",
   "GBM",
   "HNSC",
   "KIRC",
   "KIRP",
   "LGG",
   "LIHC",
   "LUAD",
   "LUSC",
   "PAAD",
   "PCPG",
   "PRAD",
   "READ",
   "STAD",
   "THCA",
   "UCEC"
  ],
  "groups": {
   "BLCA": [
    "BLCA"
   ],
   "BRCA": [
    "BRCA"
   ],
   "CESC": [
    "CESC"
   ],
   "CRC": [
    "COAD",
    "READ"
   ],
   "ESCA": [
    "ESCA"
   ],
   "GLIOMA": [
    "LGG",
    "GBM"
   ],
   "HNSC": [
    "HNSC"
   ],
   "KIRC": [
    "KIRC"
   ],
   "KIRP": [
    "KIRP"
   ],
   "LIHC": [
    "LIHC"
   ],
   "LUAD": [
    "LUAD"
   ],
   "LUSC": [
    "LUSC"
   ],
   "PAAD": [
    "PAAD"
   ],
   "PCPG": [
    "PCPG"
   ],
   "PRAD": [
    "PRAD"
   ],
   "STAD": [
    "STAD"
   ],
   "THCA": [
    "THCA"
   ],
   "UCEC": [
    "UCEC"
   ]
  },
  "excluded_projects": {
   "SARC": "excluded_from_study"
  }
 },
 "panel_totals": {
  "pre_qc": {
   "union": 8584,
   "paired": 7135,
   "rna_only": 1326,
   "met_only": 123
  },
  "post_qc": {
   "union": 8139,
   "paired": 6808,
   "rna_only": 1169,
   "met_only": 162
  },
  "normal": {
   "rna_he": 663,
   "rna_he_met": 378,
   "also_in_tumour_union": 623,
   "normal_only": 40
  },
  "patients_either_compartment": 8179
 },
 "groups": {
  "BLCA": {
   "pre_qc": {
    "union": 412,
    "paired": 406,
    "rna_only": 0,
    "met_only": 6
   },
   "post_qc": {
    "union": 401,
    "paired": 395,
    "rna_only": 0,
    "met_only": 6
   },
   "normal": {
    "rna_he": 19,
    "rna_he_met": 17,
    "also_in_tumour_union": 18,
    "normal_only": 1
   },
   "patients_either_compartment": 402,
   "projects": [
    "BLCA"
   ],
   "passes_screen": true
  },
  "BRCA": {
   "pre_qc": {
    "union": 1097,
    "paired": 782,
    "rna_only": 313,
    "met_only": 2
   },
   "post_qc": {
    "union": 1085,
    "paired": 775,
    "rna_only": 307,
    "met_only": 3
   },
   "normal": {
    "rna_he": 98,
    "rna_he_met": 73,
    "also_in_tumour_union": 98,
    "normal_only": 0
   },
   "patients_either_compartment": 1085,
   "projects": [
    "BRCA"
   ],
   "passes_screen": true
  },
  "CESC": {
   "pre_qc": {
    "union": 307,
    "paired": 304,
    "rna_only": 0,
    "met_only": 3
   },
   "post_qc": {
    "union": 302,
    "paired": 300,
    "rna_only": 0,
    "met_only": 2
   },
   "normal": {
    "rna_he": 3,
    "rna_he_met": 3,
    "also_in_tumour_union": 3,
    "normal_only": 0
   },
   "patients_either_compartment": 302,
   "projects": [
    "CESC"
   ],
   "passes_screen": true
  },
  "CRC": {
   "pre_qc": {
    "union": 624,
    "paired": 393,
    "rna_only": 231,
    "met_only": 0
   },
   "post_qc": {
    "union": 599,
    "paired": 379,
    "rna_only": 218,
    "met_only": 2
   },
   "normal": {
    "rna_he": 47,
    "rna_he_met": 19,
    "also_in_tumour_union": 46,
    "normal_only": 1
   },
   "patients_either_compartment": 600,
   "projects": [
    "COAD",
    "READ"
   ],
   "passes_screen": true
  },
  "ESCA": {
   "pre_qc": {
    "union": 185,
    "paired": 184,
    "rna_only": 0,
    "met_only": 1
   },
   "post_qc": {
    "union": 174,
    "paired": 173,
    "rna_only": 0,
    "met_only": 1
   },
   "normal": {
    "rna_he": 10,
    "rna_he_met": 8,
    "also_in_tumour_union": 10,
    "normal_only": 0
   },
   "patients_either_compartment": 174,
   "projects": [
    "ESCA"
   ],
   "passes_screen": true
  },
  "GLIOMA": {
   "pre_qc": {
    "union": 860,
    "paired": 596,
    "rna_only": 204,
    "met_only": 60
   },
   "post_qc": {
    "union": 756,
    "paired": 565,
    "rna_only": 103,
    "met_only": 88
   },
   "normal": {
    "rna_he": 5,
    "rna_he_met": 1,
    "also_in_tumour_union": 0,
    "normal_only": 5
   },
   "patients_either_compartment": 761,
   "projects": [
    "LGG",
    "GBM"
   ],
   "passes_screen": true
  },
  "HNSC": {
   "pre_qc": {
    "union": 528,
    "paired": 520,
    "rna_only": 0,
    "met_only": 8
   },
   "post_qc": {
    "union": 522,
    "paired": 514,
    "rna_only": 0,
    "met_only": 8
   },
   "normal": {
    "rna_he": 43,
    "rna_he_met": 20,
    "also_in_tumour_union": 43,
    "normal_only": 0
   },
   "patients_either_compartment": 522,
   "projects": [
    "HNSC"
   ],
   "passes_screen": true
  },
  "KIRC": {
   "pre_qc": {
    "union": 534,
    "paired": 318,
    "rna_only": 215,
    "met_only": 1
   },
   "post_qc": {
    "union": 516,
    "paired": 311,
    "rna_only": 204,
    "met_only": 1
   },
   "normal": {
    "rna_he": 71,
    "rna_he_met": 23,
    "also_in_tumour_union": 71,
    "normal_only": 0
   },
   "patients_either_compartment": 516,
   "projects": [
    "KIRC"
   ],
   "passes_screen": true
  },
  "KIRP": {
   "pre_qc": {
    "union": 291,
    "paired": 274,
    "rna_only": 16,
    "met_only": 1
   },
   "post_qc": {
    "union": 280,
    "paired": 266,
    "rna_only": 13,
    "met_only": 1
   },
   "normal": {
    "rna_he": 32,
    "rna_he_met": 23,
    "also_in_tumour_union": 32,
    "normal_only": 0
   },
   "patients_either_compartment": 280,
   "projects": [
    "KIRP"
   ],
   "passes_screen": true
  },
  "LIHC": {
   "pre_qc": {
    "union": 377,
    "paired": 371,
    "rna_only": 0,
    "met_only": 6
   },
   "post_qc": {
    "union": 368,
    "paired": 362,
    "rna_only": 0,
    "met_only": 6
   },
   "normal": {
    "rna_he": 50,
    "rna_he_met": 41,
    "also_in_tumour_union": 47,
    "normal_only": 3
   },
   "patients_either_compartment": 371,
   "projects": [
    "LIHC"
   ],
   "passes_screen": true
  },
  "LUAD": {
   "pre_qc": {
    "union": 520,
    "paired": 455,
    "rna_only": 62,
    "met_only": 3
   },
   "post_qc": {
    "union": 461,
    "paired": 406,
    "rna_only": 51,
    "met_only": 4
   },
   "normal": {
    "rna_he": 57,
    "rna_he_met": 20,
    "also_in_tumour_union": 48,
    "normal_only": 9
   },
   "patients_either_compartment": 470,
   "projects": [
    "LUAD"
   ],
   "passes_screen": true
  },
  "LUSC": {
   "pre_qc": {
    "union": 501,
    "paired": 370,
    "rna_only": 131,
    "met_only": 0
   },
   "post_qc": {
    "union": 486,
    "paired": 363,
    "rna_only": 123,
    "met_only": 0
   },
   "normal": {
    "rna_he": 47,
    "rna_he_met": 8,
    "also_in_tumour_union": 47,
    "normal_only": 0
   },
   "patients_either_compartment": 486,
   "projects": [
    "LUSC"
   ],
   "passes_screen": true
  },
  "PAAD": {
   "pre_qc": {
    "union": 184,
    "paired": 178,
    "rna_only": 0,
    "met_only": 6
   },
   "post_qc": {
    "union": 157,
    "paired": 151,
    "rna_only": 0,
    "met_only": 6
   },
   "normal": {
    "rna_he": 4,
    "rna_he_met": 4,
    "also_in_tumour_union": 4,
    "normal_only": 0
   },
   "patients_either_compartment": 157,
   "projects": [
    "PAAD"
   ],
   "passes_screen": true
  },
  "PCPG": {
   "pre_qc": {
    "union": 179,
    "paired": 179,
    "rna_only": 0,
    "met_only": 0
   },
   "post_qc": {
    "union": 178,
    "paired": 178,
    "rna_only": 0,
    "met_only": 0
   },
   "normal": {
    "rna_he": 3,
    "rna_he_met": 3,
    "also_in_tumour_union": 3,
    "normal_only": 0
   },
   "patients_either_compartment": 178,
   "projects": [
    "PCPG"
   ],
   "passes_screen": true
  },
  "PRAD": {
   "pre_qc": {
    "union": 498,
    "paired": 497,
    "rna_only": 0,
    "met_only": 1
   },
   "post_qc": {
    "union": 406,
    "paired": 405,
    "rna_only": 0,
    "met_only": 1
   },
   "normal": {
    "rna_he": 48,
    "rna_he_met": 32,
    "also_in_tumour_union": 42,
    "normal_only": 6
   },
   "patients_either_compartment": 412,
   "projects": [
    "PRAD"
   ],
   "passes_screen": true
  },
  "STAD": {
   "pre_qc": {
    "union": 434,
    "paired": 373,
    "rna_only": 39,
    "met_only": 22
   },
   "post_qc": {
    "union": 416,
    "paired": 349,
    "rna_only": 38,
    "met_only": 29
   },
   "normal": {
    "rna_he": 34,
    "rna_he_met": 0,
    "also_in_tumour_union": 31,
    "normal_only": 3
   },
   "patients_either_compartment": 419,
   "projects": [
    "STAD"
   ],
   "passes_screen": true
  },
  "THCA": {
   "pre_qc": {
    "union": 507,
    "paired": 505,
    "rna_only": 0,
    "met_only": 2
   },
   "post_qc": {
    "union": 502,
    "paired": 500,
    "rna_only": 0,
    "met_only": 2
   },
   "normal": {
    "rna_he": 58,
    "rna_he_met": 50,
    "also_in_tumour_union": 58,
    "normal_only": 0
   },
   "patients_either_compartment": 502,
   "projects": [
    "THCA"
   ],
   "passes_screen": true
  },
  "UCEC": {
   "pre_qc": {
    "union": 546,
    "paired": 430,
    "rna_only": 115,
    "met_only": 1
   },
   "post_qc": {
    "union": 530,
    "paired": 416,
    "rna_only": 112,
    "met_only": 2
   },
   "normal": {
    "rna_he": 34,
    "rna_he_met": 33,
    "also_in_tumour_union": 22,
    "normal_only": 12
   },
   "patients_either_compartment": 542,
   "projects": [
    "UCEC"
   ],
   "passes_screen": true
  }
 },
 "projects": {
  "ACC": {
   "pre_qc": {
    "union": 80,
    "paired": 79,
    "rna_only": 0,
    "met_only": 1
   },
   "post_qc": {
    "union": 79,
    "paired": 78,
    "rna_only": 0,
    "met_only": 1
   },
   "normal": {
    "rna_he": 0,
    "rna_he_met": 0,
    "also_in_tumour_union": 0,
    "normal_only": 0
   },
   "patients_either_compartment": 79,
   "aliquots": {
    "tumour": {
     "rna": {
      "retained": 78,
      "excluded": 1,
      "unresolved": 0
     },
     "met": {
      "retained": 79,
      "excluded": 1,
      "unresolved": 0
     }
    },
    "normal": {
     "rna": {
      "retained": 0,
      "excluded": 0,
      "unresolved": 0